{
  "schemaVersion": "4.4.0",
  "asOf": "2026-10-16",
  "classification": "EVIDENCE-GRADED PUBLIC FUNDING RELATIONSHIPS; NO ENDORSEMENTS; NO REAL-TIME FINANCIAL INTELLIGENCE",
  "methodology": [
    "Distinct lanes: Russian war financing and transfers supporting Russia; Ukrainian defensive assistance; civilian/reconstruction funding; financial intermediation; indirect market exposures; uncommitted prospects.",
    "A historic confirmed transaction is NOT a verified current recurring flow. A multi-year allocation does NOT establish full disbursement.",
    "SIPRI trend-indicator values are NOT currency. World Bank mobilized funds, EU loans, national aid and ERA financing may overlap: never sum raw amounts.",
    "National finance budgets and commodity tax receipts do not establish tracing of a private purchaser payment directly to military expenditure.",
    "Indirect trade exposure and potential partners must not be falsely categorized as war sponsors or sanction violators.",
    "No automatic list of people, account numbers, bank routing data, sanctions screening or tactical military procurement. No private individual targeting."
  ],
  "channels": [
    {
      "id": "budget-aggression",
      "label": "Russian state war budget / industry"
    },
    {
      "id": "external-material-to-russia",
      "label": "External military materiel supplied to Russia"
    },
    {
      "id": "defence-ukraine",
      "label": "Ukraine lawful defence support"
    },
    {
      "id": "civilian-ukraine",
      "label": "Ukraine civilian recovery / macro-finance"
    },
    {
      "id": "intermediation",
      "label": "Trust fund / asset proceeds administration"
    },
    {
      "id": "indirect-exposure",
      "label": "Indirect state revenue / market exposure"
    },
    {
      "id": "prospective",
      "label": "Prospective partner, no commitment"
    }
  ],
  "statuses": [
    {
      "id": "confirmed-recurring",
      "label": "Confirmed recurring / multi-year programme"
    },
    {
      "id": "confirmed-dated",
      "label": "Documented historical or dated support"
    },
    {
      "id": "indirect-documented",
      "label": "Documented aggregate revenue, indirect nexus"
    },
    {
      "id": "potential-unverified",
      "label": "Potential only / no established commitment"
    }
  ],
  "sources": [
    {
      "id": "kiel-oct26",
      "title": "Kiel Ukraine Support Tracker — October 2026 update",
      "date": "2026-10-08",
      "kind": "independent-research",
      "url": "https://www.kielinstitut.de/index.php?id=10"
    },
    {
      "id": "sipri-mar26",
      "title": "SIPRI Trends in International Arms Transfers 2025",
      "date": "2026-03-09",
      "kind": "independent-research",
      "url": "https://www.sipri.org/publications/2026/sipri-fact-sheets/trends-international-arms-transfers-2025"
    },
    {
      "id": "russia-rev-oct26",
      "title": "Reuters estimate: Russian oil and gas tax revenue in October 2026",
      "date": "2026-10-15",
      "kind": "professional-reporting",
      "url": "https://www.reuters.com/business/energy/russias-oil-gas-revenue-seen-up-10-yy-october-12-billion-2026-10-15/"
    },
    {
      "id": "uk-evidence",
      "title": "UK support to Ukraine fact sheet, updated 13 October 2026",
      "date": "2026-10-13",
      "kind": "official-government",
      "url": "https://www.gov.uk/government/publications/uk-support-to-ukraine-factsheet/uk-support-to-ukraine-factsheet"
    },
    {
      "id": "norway-2026",
      "title": "Norway 2026 Nansen Support Programme allocation",
      "date": "2026-01-12",
      "kind": "official-government",
      "url": "https://www.regjeringen.no/en/whats-new/allocation-of-funding-under-the-nansen-support-programme-for-ukraine-in-2026/id3145799/"
    },
    {
      "id": "norway-programme",
      "title": "Norway Nansen Programme multi-year funding summary",
      "date": "2026-01-12",
      "kind": "official-government",
      "url": "https://www.regjeringen.no/en/topics/foreign-affairs/humanitarian-efforts/neighbour_support/id2908141/"
    },
    {
      "id": "sweden-2026",
      "title": "Swedish government military support to Ukraine 2026–27",
      "date": "2026-05-28",
      "kind": "official-government",
      "url": "https://www.government.se/government-policy/swedens-support-to-ukraine/military-support-to-ukraine/"
    },
    {
      "id": "germany-2026",
      "title": "German federal government Ukraine assistance summary",
      "date": "2026-09-01",
      "kind": "official-government",
      "url": "https://www.bundesregierung.de/breg-en/service/germany-aid-for-ukraine-2192480"
    },
    {
      "id": "canada-2026",
      "title": "Canada Department of National Defence Ukraine military and energy support",
      "date": "2026-02-24",
      "kind": "official-government",
      "url": "https://www.canada.ca/en/department-national-defence/news/2026/02/government-of-canada-reaffirms-unwavering-support-for-ukraine-four-years-into-russias-full-scale-invasion.html"
    },
    {
      "id": "netherlands-2026",
      "title": "Netherlands additional 2027–29 Ukraine civilian reconstruction support",
      "date": "2026-09-15",
      "kind": "official-government",
      "url": "https://www.government.nl/latest/news/2026/09/15/budget-day-2026-extra-money-to-support-ukraine-and-for-development-cooperation"
    },
    {
      "id": "netherlands-purl",
      "title": "Netherlands 2026 Ukraine military assistance package",
      "date": "2026-06-18",
      "kind": "official-government",
      "url": "https://www.rijksoverheid.nl/actueel/nieuws/2026/06/18/nieuw-steunpakket-van-euro-500-miljoen-voor-oekraine"
    },
    {
      "id": "denmark-2026",
      "title": "Danish Ministry of Foreign Affairs funding overview",
      "date": "2026-08-13",
      "kind": "official-government",
      "url": "https://um.dk/en/foreign-policy/danish-support-for-ukraine"
    },
    {
      "id": "eu-facility",
      "title": "Council EU Ukraine Facility: multi-year plan",
      "date": "2026-09-24",
      "kind": "official-institution",
      "url": "https://www.consilium.europa.eu/en/policies/ukraine-facility/"
    },
    {
      "id": "eu-era",
      "title": "Council of EU G7 ERA loan mechanism",
      "date": "2024-10-23",
      "kind": "official-institution",
      "url": "https://www.consilium.europa.eu/en/press/press-releases/2024/10/23/immobilised-assets-council-greenlights-up-to-35-billion-in-macro-financial-assistance-to-ukraine-and-new-loan-mechanism-implementing-g7-commitment/"
    },
    {
      "id": "eu-loan",
      "title": "Kiel briefing: 2026–27 EU Ukraine Support Loan and US weapons reliance",
      "date": "2026-08-13",
      "kind": "independent-research",
      "url": "https://www.kielinstitut.de/media/news/ukraine-support-tracker-europe-leads-on-aid-us-weapons-remain-key/"
    },
    {
      "id": "worldbank-donor",
      "title": "World Bank Group donor financing mechanisms for Ukraine",
      "date": "2026-04-13",
      "kind": "official-institution",
      "url": "https://www.worldbank.org/en/brief/2026/04/13/world-bank-group-donor-financing-mechanisms-for-supporting-ukraine"
    },
    {
      "id": "worldbank-finance",
      "title": "World Bank financing mobilized through August 2026",
      "date": "2026-08-31",
      "kind": "official-institution",
      "url": "https://www.worldbank.org/en/brief/2026/05/31/world-bank-emergency-financing-package-for-ukraine"
    },
    {
      "id": "ebrd-2026",
      "title": "EBRD 2026 recovery conference investments",
      "date": "2026-06-26",
      "kind": "official-institution",
      "url": "https://www.ebrd.com/home/news-and-events/news/2026/ebrd-support-for-wartime-ukraine-surpasses--10-5-billion-as-bank.html"
    },
    {
      "id": "ebrd-plan",
      "title": "EBRD strategic capital framework 2026–30",
      "date": "2025-05-01",
      "kind": "official-institution",
      "url": "https://www.ebrd.com/home/what-we-do/strategic-and-capital-framework.html"
    },
    {
      "id": "imf-review",
      "title": "IMF four-year Ukraine EFF arrangement review",
      "date": "2026-06-12",
      "kind": "official-institution",
      "url": "https://www.imf.org/en/news/articles/2026/06/12/pr-26202-ukraine-imf-reaches-agreement-1st-rev-of-eff-arrang-2026-art-iv-consult"
    },
    {
      "id": "eu-industrial-oct26",
      "title": "EU Council sanctions 826 companies in Russian military-industrial complex, 12 October 2026",
      "date": "2026-10-12",
      "kind": "official-institution",
      "url": "https://www.consilium.europa.eu/en/press/press-releases/2026/10/12/russia-s-war-of-aggression-against-ukraine-eu-agrees-largest-ever-package-of-listings-targeting-almost-1600-individuals-and-entities-in-russia-s-military-industrial-complex/"
    },
    {
      "id": "eu-dprk-oct26",
      "title": "EU Council reports DPRK-Russia military-economic collaboration and arms-for-oil trade, 12 October 2026",
      "date": "2026-10-12",
      "kind": "official-institution",
      "url": "https://www.consilium.europa.eu/da/press/press-releases/2026/10/12/dprk-council-adds-three-individuals-and-four-entities-to-sanctions-lists-over-nuclear-missile-programmes-and-russia-ties/"
    }
  ],
  "profiles": [
    {
      "id": "rus-budget",
      "actorId": "russia",
      "channel": "budget-aggression",
      "status": "confirmed-recurring",
      "title": "Russian federal government war expenditure",
      "description": "State budget outlays fund Russian military operations; oil/gas taxes are one revenue stream.",
      "amountOrMetric": "Oil/gas revenue forecast ≈ RUB 1 trillion for October 2026; ≈20% of total government income; NOT a traced payment to a specific unit.",
      "limits": "Revenue is fungible; this is not an audited rupee-by-rupee war-spending ledger.",